{"schema_version":"sim-package-v1","contract_version":"1.0.0","verification_status":"verified","open_issues":[],"simulation":{"id":"SIM-ROBOT-DT","work_order_id":"WO-ROBOT-DT","title":"工业机器人工作站数字孪生调试包","runtime":{"platform":"Dachen DT Sandbox","version":"1.0.0","isolation_mode":"offline"},"vc_assets":[{"asset_id":"ASSET-ROBOT-CELL-001","source_uri":"registry://cvte/robot-cell/test","version":"1.0.0","coordinate_system":"WCS-mm","mapping_role":"机器人、围栏、工装与工件","collision_model":"enabled"}],"robot_teach_pendant":{"robot_model":"6-axis industrial robot simulator","script_language":"RAPID-like","program":"PROC main(); MoveJ home; MoveL pick; MoveL place; ENDPROC","interaction_events":[{"event":"safety_gate","trigger":"gate_closed_and_reset","expected_state":"motion_enabled_in_sim_only"},{"event":"collision","trigger":"collision_detected","expected_state":"stop_and_checkpoint"}]},"checkpoints":[{"id":"SIM-CP-ROBOT-01","after_step":1,"saved_state":["safety_state","scene_version"],"resume_policy":"resume only after teacher release"},{"id":"SIM-CP-ROBOT-02","after_step":3,"saved_state":["program","I/O","coordinates","fault_state"],"resume_policy":"resume from last safe state"}],"hardware_mapping":{"plc_io":[{"sim_signal":"CELL_READY","plc_address":"SIM:I0.0","direction":"input","data_type":"BOOL","safe_default":"false"},{"sim_signal":"ROBOT_FAULT","plc_address":"SIM:Q0.0","direction":"output","data_type":"BOOL","safe_default":"true"}],"teach_coordinates":[{"name":"TCP_PICK","frame":"WCS","units":"mm","values":[450,120,300,180,0,90],"tolerance":"±1 mm"}]},"validation":[{"test":"schema and ID chain","result":"pass","evidence":"automated pre-commit validation"},{"test":"collision and recovery","result":"pass","evidence":"collision.log; recovery.log"},{"test":"real hardware isolation","result":"pass","evidence":"offline mode and SIM-only I/O"}]},"tracking_chain":["JOB-ROBOT-001 -> COMP-ROBOT-DT -> MOD-ROBOT-DT -> SCN-ROBOT-DT -> WO-ROBOT-DT -> SIM-ROBOT-DT -> AUDIT-ROBOT-001"]}